{"$schema":"https://json-schema.org/draft/2020-12/schema","title":"RFC Record","type":"object","required":["id","number","title","publicationDate","status","stream","updates","updatedBy","obsoletes","obsoletedBy","doi","url","lastVerified"],"properties":{"id":{"type":"string","pattern":"^rfc\\.[0-9]+$"},"number":{"type":"integer","minimum":1},"title":{"type":"string"},"publicationDate":{"type":"string"},"status":{"type":"string"},"stream":{"type":"string"},"updates":{"$ref":"#/$defs/numbers"},"updatedBy":{"$ref":"#/$defs/numbers"},"obsoletes":{"$ref":"#/$defs/numbers"},"obsoletedBy":{"$ref":"#/$defs/numbers"},"doi":{"type":"string"},"url":{"type":"string","format":"uri"},"lastVerified":{"type":"string","format":"date"}},"$defs":{"numbers":{"type":"array","items":{"type":"integer"},"uniqueItems":true}},"additionalProperties":false}
