[
  {"id":"rfc.2026","number":2026,"title":"The Internet Standards Process — Revision 3","publicationDate":"1996-10","status":"Best Current Practice","stream":"IETF","updates":[],"updatedBy":[3667,3668,3932,3978,3979,5378,5657,5742,6410,7100,7127,7475,8179,8789,9282],"obsoletes":[1602],"obsoletedBy":[],"doi":"10.17487/RFC2026","url":"https://www.rfc-editor.org/info/rfc2026","lastVerified":"2026-07-17"},
  {"id":"rfc.9110","number":9110,"title":"HTTP Semantics","publicationDate":"2022-06","status":"Internet Standard","stream":"IETF","updates":[3864],"updatedBy":[],"obsoletes":[2818,7230,7231,7232,7233,7235,7538,7615,7694],"obsoletedBy":[],"doi":"10.17487/RFC9110","url":"https://www.rfc-editor.org/info/rfc9110","lastVerified":"2026-07-17"},
  {"id":"rfc.8446","number":8446,"title":"The Transport Layer Security (TLS) Protocol Version 1.3","publicationDate":"2018-08","status":"Proposed Standard — Obsolete","stream":"IETF","updates":[5705,6066],"updatedBy":[],"obsoletes":[5077,5246,6961],"obsoletedBy":[9846],"doi":"10.17487/RFC8446","url":"https://www.rfc-editor.org/info/rfc8446","lastVerified":"2026-07-17"},
  {"id":"rfc.9846","number":9846,"title":"The Transport Layer Security (TLS) Protocol Version 1.3","publicationDate":"2026-07","status":"Proposed Standard","stream":"IETF","updates":[5705,6066],"updatedBy":[],"obsoletes":[5077,5246,6961,7627,8422,8446],"obsoletedBy":[],"doi":"10.17487/RFC9846","url":"https://www.rfc-editor.org/info/rfc9846","lastVerified":"2026-07-17"},
  {"id":"rfc.6635","number":6635,"title":"RFC Editor Model (Version 2)","publicationDate":"2012-06","status":"Informational","stream":"IAB","updates":[],"updatedBy":[],"obsoletes":[5620],"obsoletedBy":[8728],"doi":"10.17487/RFC6635","url":"https://www.rfc-editor.org/info/rfc6635","lastVerified":"2026-07-17"},
  {"id":"rfc.9920","number":9920,"title":"RFC Editor Model (Version 3)","publicationDate":"2026-02","status":"Informational","stream":"Editorial","updates":[7841,7991,7992,7993,7994,7995,7996,7997,8729,8730,9720],"updatedBy":[],"obsoletes":[9280],"obsoletedBy":[],"doi":"10.17487/RFC9920","url":"https://www.rfc-editor.org/info/rfc9920","lastVerified":"2026-07-17"}
]
